{
  "schema": "hubzz-prealpha-source-avatars-v1",
  "schemaVersion": 1,
  "generatedAt": "2026-10-29T16:24:52Z",
  "snapshotId": "vrmcat-v1-e6ce46d23c82976f78add8b0",
  "setSlug": "avastars",
  "count": 1,
  "reachableCount": 1,
  "binaryValidatedCount": 1,
  "avatars": [
    {
      "id": "sample",
      "tokenId": null,
      "name": "Avastars sample",
      "originalSourceUrl": "https://ipfs.io/ipfs/QmWXa41YRBdJpZUwwYiXakTAkza2efT8hzbS5t8imXyTpC/Avastar_Founder_1.vrm",
      "transportUrl": "https://ipfs.io/ipfs/QmWXa41YRBdJpZUwwYiXakTAkza2efT8hzbS5t8imXyTpC/Avastar_Founder_1.vrm",
      "thumbnailUrl": null,
      "reachable": true,
      "vrmValidated": true,
      "validationScope": "collection_sample_binary",
      "checkedAt": "2026-08-10T13:47:53Z",
      "checkStatus": "ok_vrm",
      "vrmSpec": null,
      "fileSizeOriginal": 13950876
    }
  ]
}
