{
  "schema": "hubzz-prealpha-source-avatars-v1",
  "schemaVersion": 1,
  "generatedAt": "2026-10-29T16:24:52Z",
  "snapshotId": "vrmcat-v1-e6ce46d23c82976f78add8b0",
  "setSlug": "boomboxheads-v2",
  "count": 1,
  "reachableCount": 1,
  "binaryValidatedCount": 1,
  "avatars": [
    {
      "id": "sample",
      "tokenId": null,
      "name": "Boomboxheads V2 sample",
      "originalSourceUrl": "ipfs://QmURAuSRmFFAyragN3h6M6thhMhBPQmNgoNJApDSvob3D5/30.vrm",
      "transportUrl": "ipfs://QmURAuSRmFFAyragN3h6M6thhMhBPQmNgoNJApDSvob3D5/30.vrm",
      "thumbnailUrl": null,
      "reachable": true,
      "vrmValidated": true,
      "validationScope": "collection_sample_binary",
      "checkedAt": "2026-08-11T20:16:07Z",
      "checkStatus": "ok_vrm",
      "vrmSpec": null,
      "fileSizeOriginal": 3139032
    }
  ]
}
