{
  "schema": "hubzz-prealpha-source-avatars-v1",
  "schemaVersion": 1,
  "generatedAt": "2026-10-29T16:24:52Z",
  "snapshotId": "vrmcat-v1-e6ce46d23c82976f78add8b0",
  "setSlug": "dickbuttverse",
  "count": 1,
  "reachableCount": 1,
  "binaryValidatedCount": 1,
  "avatars": [
    {
      "id": "sample",
      "tokenId": null,
      "name": "DickButtVerse sample",
      "originalSourceUrl": "https://small.deccdn.com/paths/dbvTour/3dassets/assets/sept30/vrm/0.vrm",
      "transportUrl": "https://small.deccdn.com/paths/dbvTour/3dassets/assets/sept30/vrm/0.vrm",
      "thumbnailUrl": null,
      "reachable": true,
      "vrmValidated": true,
      "validationScope": "collection_sample_binary",
      "checkedAt": "2026-08-12T18:43:32.489748+00:00",
      "checkStatus": "ok_vrm",
      "vrmSpec": null,
      "fileSizeOriginal": 2928488
    }
  ]
}
