{
  "schema": "hubzz-prealpha-source-avatars-v1",
  "schemaVersion": 1,
  "generatedAt": "2026-10-08T16:55:10Z",
  "snapshotId": "vrmcat-v1-268feafacb44826d7b953020",
  "setSlug": "meebits",
  "count": 1,
  "reachableCount": 1,
  "binaryValidatedCount": 1,
  "avatars": [
    {
      "id": "sample",
      "tokenId": null,
      "name": "Meebits sample",
      "originalSourceUrl": "https://api.meebits.app/v2/3d/larvalabs_vrm/17438",
      "transportUrl": "https://api.meebits.app/v2/3d/larvalabs_vrm/17438",
      "thumbnailUrl": null,
      "reachable": true,
      "vrmValidated": true,
      "validationScope": "collection_sample_binary",
      "checkedAt": "2026-08-10T13:47:53Z",
      "checkStatus": "ok_vrm",
      "vrmSpec": null,
      "fileSizeOriginal": 718232
    }
  ]
}
