{
  "schema": "hubzz-prealpha-source-avatars-v1",
  "schemaVersion": 1,
  "generatedAt": "2026-10-08T16:55:10Z",
  "snapshotId": "vrmcat-v1-268feafacb44826d7b953020",
  "setSlug": "phettaverse-editions",
  "count": 1,
  "reachableCount": 1,
  "binaryValidatedCount": 1,
  "avatars": [
    {
      "id": "sample",
      "tokenId": null,
      "name": "Phettaverse Editions sample",
      "originalSourceUrl": "ipfs://QmZYVVP2XMNK2mjcrac6zyocvAU9xuEupZ4zYuoPVuimr7/borgormachinelowpoly.vrm",
      "transportUrl": "ipfs://QmZYVVP2XMNK2mjcrac6zyocvAU9xuEupZ4zYuoPVuimr7/borgormachinelowpoly.vrm",
      "thumbnailUrl": null,
      "reachable": true,
      "vrmValidated": true,
      "validationScope": "collection_sample_binary",
      "checkedAt": "2026-08-11T20:16:07Z",
      "checkStatus": "ok_vrm",
      "vrmSpec": null,
      "fileSizeOriginal": 1698236
    }
  ]
}
