{
  "schema": "hubzz-prealpha-source-avatars-v1",
  "schemaVersion": 1,
  "generatedAt": "2026-10-15T14:23:35Z",
  "snapshotId": "vrmcat-v1-a7929cd29484b4fc50eb8d02",
  "setSlug": "metaanigen",
  "count": 1,
  "reachableCount": 1,
  "binaryValidatedCount": 1,
  "avatars": [
    {
      "id": "sample",
      "tokenId": null,
      "name": "MetaaniGEN sample",
      "originalSourceUrl": "ipfs://QmaNMoE1yFGPqdiiFuBkoo26utAXsf7WdxutUKWkFiJDTF",
      "transportUrl": "ipfs://QmaNMoE1yFGPqdiiFuBkoo26utAXsf7WdxutUKWkFiJDTF",
      "thumbnailUrl": null,
      "reachable": true,
      "vrmValidated": true,
      "validationScope": "collection_sample_binary",
      "checkedAt": "2026-08-10T13:47:53Z",
      "checkStatus": "ok_vrm",
      "vrmSpec": null,
      "fileSizeOriginal": 921444
    }
  ]
}
