{
  "schema": "hubzz-prealpha-source-avatars-v1",
  "schemaVersion": 1,
  "generatedAt": "2026-10-08T16:55:10Z",
  "snapshotId": "vrmcat-v1-268feafacb44826d7b953020",
  "setSlug": "forgottenruneswizardscult",
  "count": 1,
  "reachableCount": 1,
  "binaryValidatedCount": 1,
  "avatars": [
    {
      "id": "sample",
      "tokenId": null,
      "name": "Forgotten Runes Wizards Cult sample",
      "originalSourceUrl": "https://nftz.forgottenrunes.com/dev/3d/wizards/7362/wizard_7362.vrm",
      "transportUrl": "https://nftz.forgottenrunes.com/dev/3d/wizards/7362/wizard_7362.vrm",
      "thumbnailUrl": null,
      "reachable": true,
      "vrmValidated": true,
      "validationScope": "collection_sample_binary",
      "checkedAt": "2026-08-10T13:47:53Z",
      "checkStatus": "ok_vrm",
      "vrmSpec": null,
      "fileSizeOriginal": 3207404
    }
  ]
}
