{
  "schema": "hubzz-prealpha-source-avatars-v1",
  "schemaVersion": 1,
  "generatedAt": "2026-10-15T14:23:35Z",
  "snapshotId": "vrmcat-v1-a7929cd29484b4fc50eb8d02",
  "setSlug": "NeonGlitch86-collection",
  "count": 9,
  "reachableCount": 9,
  "binaryValidatedCount": 9,
  "avatars": [
    {
      "id": "0x776bd31ae5549eac9ed215b5db278229454d5bed/11",
      "tokenId": "11",
      "name": "FAST FOOD MAX",
      "originalSourceUrl": "https://raw.githubusercontent.com/neonglitch86/vrm/main/MAXMCD.vrm",
      "thumbnailUrl": "https://arweave.net/lM6kd_rGpBGtdr73WAIJuJlXXn7c_ulAOH62NJRrkKQ",
      "reachable": true,
      "vrmValidated": true,
      "validationScope": "per_avatar_binary",
      "checkedAt": "2026-08-11T19:59:01Z",
      "checkStatus": "ok_vrm",
      "vrmSpec": "0.x",
      "fileSizeOriginal": 11066668
    },
    {
      "id": "0x776bd31ae5549eac9ed215b5db278229454d5bed/4",
      "tokenId": "4",
      "name": "STEAMBOAT SUMMER",
      "originalSourceUrl": "https://raw.githubusercontent.com/neonglitch86/vrm/main/SBW_86.vrm",
      "thumbnailUrl": "https://arweave.net/dGMN953a_XfrjGh-CIM8FZNrb11vq0vl5FHJZ7pISmE",
      "reachable": true,
      "vrmValidated": true,
      "validationScope": "per_avatar_binary",
      "checkedAt": "2026-08-11T19:59:01Z",
      "checkStatus": "ok_vrm",
      "vrmSpec": "0.x",
      "fileSizeOriginal": 7372308
    },
    {
      "id": "0x776bd31ae5549eac9ed215b5db278229454d5bed/5",
      "tokenId": "5",
      "name": "STEAMBOAT SUMMER V2",
      "originalSourceUrl": "https://raw.githubusercontent.com/neonglitch86/vrm/main/SBW_86v2.vrm",
      "thumbnailUrl": "https://arweave.net/HdmdbkYwV60BZl4z_zR5Cu5PhhyWrS6syRgiffVSYn8",
      "reachable": true,
      "vrmValidated": true,
      "validationScope": "per_avatar_binary",
      "checkedAt": "2026-08-11T19:59:01Z",
      "checkStatus": "ok_vrm",
      "vrmSpec": "0.x",
      "fileSizeOriginal": 8266048
    },
    {
      "id": "0x776bd31ae5549eac9ed215b5db278229454d5bed/6",
      "tokenId": "6",
      "name": "Summer V2",
      "originalSourceUrl": "https://raw.githubusercontent.com/neonglitch86/vrm/main/Summer_pbr.vrm",
      "thumbnailUrl": "https://arweave.net/qXnxmxM1QFlCjtEk8nQsAf5OXVGdiQOwoHdhpCeCunI",
      "reachable": true,
      "vrmValidated": true,
      "validationScope": "per_avatar_binary",
      "checkedAt": "2026-08-11T19:59:01Z",
      "checkStatus": "ok_vrm",
      "vrmSpec": "0.x",
      "fileSizeOriginal": 6271948
    },
    {
      "id": "0x776bd31ae5549eac9ed215b5db278229454d5bed/7",
      "tokenId": "7",
      "name": "EL BUENO",
      "originalSourceUrl": "https://raw.githubusercontent.com/neonglitch86/vrm/main/G_C.vrm",
      "thumbnailUrl": "https://arweave.net/2NIRlEzFXb8aqaICk1qR211Ce2AiJXuupuwFZCvg6z0",
      "reachable": true,
      "vrmValidated": true,
      "validationScope": "per_avatar_binary",
      "checkedAt": "2026-08-11T19:59:01Z",
      "checkStatus": "ok_vrm",
      "vrmSpec": "0.x",
      "fileSizeOriginal": 5909304
    },
    {
      "id": "0x776bd31ae5549eac9ed215b5db278229454d5bed/8",
      "tokenId": "8",
      "name": "EL MALO",
      "originalSourceUrl": "https://raw.githubusercontent.com/neonglitch86/vrm/main/G_A.vrm",
      "thumbnailUrl": "https://arweave.net/7yjwe596z3G4iDQ8VowtudguPwKXSp9mkNSeBRWXNiI",
      "reachable": true,
      "vrmValidated": true,
      "validationScope": "per_avatar_binary",
      "checkedAt": "2026-08-11T19:59:01Z",
      "checkStatus": "ok_vrm",
      "vrmSpec": "0.x",
      "fileSizeOriginal": 4186576
    },
    {
      "id": "0x776bd31ae5549eac9ed215b5db278229454d5bed/9",
      "tokenId": "9",
      "name": "EL FEO",
      "originalSourceUrl": "https://raw.githubusercontent.com/neonglitch86/vrm/main/G_B.vrm",
      "thumbnailUrl": "https://arweave.net/WnLZisvOeMPteRTbZP_1v226e3h7QPaT9VxLgvIIVGc",
      "reachable": true,
      "vrmValidated": true,
      "validationScope": "per_avatar_binary",
      "checkedAt": "2026-08-11T19:59:01Z",
      "checkStatus": "ok_vrm",
      "vrmSpec": "0.x",
      "fileSizeOriginal": 4381744
    },
    {
      "id": "0xcdffc2fae679814913305c13edb86fe7967dbeea/1",
      "tokenId": "1",
      "name": "SHAPEY",
      "originalSourceUrl": "https://raw.githubusercontent.com/neonglitch86/vrm/main/shapey.vrm",
      "thumbnailUrl": "https://arweave.net/rqMsUb8gx-bKZisadpvbxbS4zqnJswi0iGvsB92Onfw",
      "reachable": true,
      "vrmValidated": true,
      "validationScope": "per_avatar_binary",
      "checkedAt": "2026-08-11T19:59:01Z",
      "checkStatus": "ok_vrm",
      "vrmSpec": "1.0",
      "fileSizeOriginal": 1590520
    },
    {
      "id": "0xe7ba6df2934c487bb49435394fdd4b80268e2d3c/1",
      "tokenId": "1",
      "name": "GARY GRIFTER 1.0",
      "originalSourceUrl": "https://raw.githubusercontent.com/neonglitch86/vrm/main/GG_1.vrm",
      "thumbnailUrl": "https://arweave.net/KXfRbY3s170JGMRH4w8VEHxc1SwUNx_Juyqp7T7XJys",
      "reachable": true,
      "vrmValidated": true,
      "validationScope": "per_avatar_binary",
      "checkedAt": "2026-08-11T19:59:01Z",
      "checkStatus": "ok_vrm",
      "vrmSpec": "0.x",
      "fileSizeOriginal": 5565488
    }
  ]
}
